Review,Rating
Tried to go here for lunch and it was a madhouse ,bad
After waiting an hour and being seated I was not in the greatest of moods ,bad
The Macarons here are insanely good ,good
Our waiter was very attentive friendly and informative ,good
Maybe if they werent cold they would have been somewhat edible ,bad
Great food ,good
Hands down my favorite Italian restaurant ,good
That just SCREAMS LEGIT in my booksomethats also pretty rare here in Vegas ,good
It was just not a fun experience ,good
The atmosphere was great with a lovely duo of violinists playing songs we requested ,good
Very convenient since we were staying at the MGM ,good
The sweet potato tots were good but the onion rings were perfection or as close as I have had ,good
Google mediocre and I imagine Smashburger will pop up ,bad
dont go here ,bad
I promise they wont disappoint ,good
As a sushi lover avoid this place by all means ,bad
What a great double cheeseburger ,good
Awesome service and food ,good
A fantastic neighborhood gem  ,good
Service was slow and not attentive ,bad
I gave it 5 stars then and Im giving it 5 stars now ,good
Dessert Panna Cotta was amazing ,good
Very good food great atmosphere 1 ,good
Prices are very reasonable flavors are spot on the sauce is home made and the slaw is not drenched in mayo ,good
The steak was amazingrge fillet relleno was the best seafood plate i have ever had ,good
Good food  good service  ,good
It was absolutely amazing ,good
will definitely be back ,good
Hawaiian Breeze Mango Magic and Pineapple Delight are the smoothies that Ive tried so far and theyre all good ,good
Needless to say we will never be back here again ,bad
Anyways The food was definitely not filling at all and for the price you pay you should expect more ,bad
The chips that came out were dripping with grease and mostly not edible ,bad
Our server was very nice and attentive as were the other serving staff ,good
I work in the hospitality industry in Paradise Valley and have refrained from recommending Cibo any longer ,bad
The atmosphere here is fun ,good
Service is quick and even to go orders are just like we like it ,good
That said our mouths and bellies were still quite pleased ,good
Not my thing ,bad
If you are reading this please dont go there ,bad
I loved the grilled pizza reminded me of legit Italian pizza ,good
Only Pros  Large seating area Nice bar area Great simple drink menu The BEST brick oven pizza with homemade dough ,good
After one bite I was hooked ,good
The food was great as always compliments to the chef ,good
Awesome selection of beer ,good
One nice thing was that they added gratuity on the bill since our party was larger than 6 or 8 and they didnt expect more tip than that ,good
The Han Nan Chicken was also very tasty ,good
As for the service I thought it was good ,good
Ryans Bar is definitely one Edinburgh establishment I wont be revisiting ,bad
Nicest Chinese restaurant Ive been in a while ,good
Friends pasta  also bad he barely touched it ,bad
I love the decor with the Chinese calligraphy wall paper ,good
Im not sure how long we stood there but it was long enough for me to begin to feel awkwardly out of place ,bad
When I opened the sandwich I was impressed but not in a good way ,bad
There was a warm feeling with the service and I felt like their guest for a special treat ,good
I always order from the vegetarian menu during dinner which has a wide array of options to choose from ,good
I got to enjoy the seafood salad with a fabulous vinegrette ,good
The wontons were thin not thick and chewy almost melt in your mouth ,good
We were sat right on time and our server from the get go was FANTASTIC ,good
Main thing I didnt enjoy is that the crowd is of older crowd around mid 30s and up ,bad
I had to wait over 30 minutes to get my drink and longer to get 2 arepas ,bad
This is a GREAT place to eat ,good
The jalapeno bacon is soooo good ,good
The service was poor and thats being nice ,bad
Food was good service was good Prices were good ,good
The place was not clean and the food oh so stale ,bad
But the service was beyond bad ,bad
"Im so happy to be here"" ",good
Tasted like dirt ,bad
One of the few places in Phoenix that I would definately go back to again  ,good
Its close to my house its lowkey nonfancy affordable prices good food ,good
My sashimi was poor quality being soggy and tasteless ,bad
the food is not tasty at all not to say its real traditional Hunan style  ,bad
The flair bartenders are absolutely amazing ,good
These were so good we ordered them twice ,good
So in a nutshell 1 The restaraunt smells like a combination of a dirty fish market and a sewer ,bad
My girlfriends veal was very bad ,bad
Join the club and get awesome offers via email ,good
Perfect for someone me who only likes beer ice cold or in this case even colder ,good
The nachos are a MUST HAVE ,good
We will not be coming back ,bad
I dont have very many words to say about this place but it does everything pretty well ,good
The staff is super nice and very quick even with the crazy crowds of the downtown juries lawyers and court staff ,good
Great atmosphere friendly and fast service ,good
When I received my Pita it was huge it did have a lot of meat in it so thumbs up there ,good
The classic Maine Lobster Roll was fantastic ,good
This place is great ,good
Im super pissd ,bad
Lastly the mozzarella sticks they were the best thing we ordered ,good
The service was terrible though ,bad
I love this place ,good
I can say that the desserts were yummy ,good
The food was terrible ,bad
Do not waste your money here ,bad
I love that they put their food in nice plastic containers as opposed to cramming it in little paper takeout boxes ,good
Wont ever go here again ,bad
Food quality has been horrible ,bad
For that price I can think of a few place I would have much rather gone ,bad
I do love sushi but I found Kabuki to be overpriced overhip and underservices ,bad
Do yourself a favor and stay away from this dish ,bad
Very poor service ,bad
I have never had such bland food which surprised me considering the article we read focused so much on their spices and flavor ,bad
Food is way overpriced and portions are fucking small ,bad
I recently tried Caballeros and I have been back every week since ,good
for 40 bucks a head i really expect better food ,bad
I wont be back ,bad
This place deserves no stars ,bad
In fact Im going to round up to 4 stars just because she was so awesome ,good
I probably would not go here again ,bad
The price is reasonable and the service is great ,good
The Wife hated her meal coconut shrimp and our friends really did not enjoy their meals either ,bad
My fella got the huevos rancheros and they didnt look too appealing ,bad
I probably wont be coming back here ,bad
Worst food/service Ive had in a while ,bad
Hot dishes are not hot cold dishes are close to room tempI watched staff prepare food with BARE HANDS no glovesEverything is deep fried in oil ,bad
Always a pleasure dealing with him ,good
This place is awesome if you want something light and healthy during the summer ,good
The service was great even the manager came and helped with our table ,good
this is the worst sushi i have ever eat besides Costcos ,bad
All in all an excellent restaurant highlighted by great service a unique menu and a beautiful setting ,good
My boyfriend and i sat at the bar and had a completely delightful experience ,good
Go To Place for Gyros ,good
I found a six inch long piece of wire in my salsa ,bad
We definately enjoyed ourselves ,good
I had about two bites and refused to eat anymore ,bad
Seriously killer hot chai latte ,good
Their rotating beers on tap is also a highlight of this place ,good
Pricing is a bit of a concern at Mellow Mushroom ,bad
Worst Thai ever ,bad
If you stay in Vegas you must get breakfast here at least once ,good
Highly unprofessional and rude to a loyal patron ,bad
Overall a great experience ,good
Also I feel like the chips are bought not made in house ,bad
After the disappointing dinner we went elsewhere for dessert ,bad
The chips and sals a here is amazing ,good
We wont be returning ,bad
This is my new fav Vegas buffet spot ,good
I seriously cannot believe that the owner has so many unexperienced employees that all are running around like chickens with their heads cut off ,bad
i felt insulted and disrespected how could you talk and judge another human being like that? ,bad
How can you call yourself a steakhouse if you cant properly cook a steak I dont understand ,bad
The only thing I wasnt too crazy about was their guacamole as I dont like it pureed ,bad
There is really nothing for me at postinos hope your experience is better ,bad
This place is disgusting ,bad
Every time I eat here I see caring teamwork to a professional degree ,good
However there was so much garlic in the fondue it was barely edible ,bad
I could barely stomach the meal but didnt complain because it was a business lunch ,bad
It also took her forever to bring us the check when we asked for it ,bad
Disappointing experience ,bad
If you want to wait for mediocre food and downright terrible service then this is the place for you ,bad
We wont be going back ,bad
The place was fairly clean but the food simply wasnt worth it ,bad
The meat was pretty dry I had the sliced brisket and pulled pork ,bad
It was equally awful ,bad
very slow at seating even with reservation ,bad
The chipolte ranch dipping sause was tasteless seemed thin and watered down with no heat ,bad
I was VERY disappointed ,bad
Maybe its just their Vegetarian fare but Ive been twice and I thought it was average at best ,bad
The tables outside are also dirty a lot of the time and the workers are not always friendly and helpful with the menu ,bad
But then they came back cold ,bad
Then our food came out disappointment ensued ,bad
The only reason to eat here would be to fill up before a night of binge drinking just to get some carbs in your stomach ,bad
Insults profound deuchebaggery and had to go outside for a smoke break while serving just to solidify it ,bad
If someone orders two tacos dont you think it may be part of customer service to ask if it is combo or ala cart? ,bad
After all the rave reviews I couldnt wait to eat herewhat a disappointment ,bad
Its NOT hard to make a decent hamburger ,bad
But I dont like it ,bad
Hell no will I go back ,bad
I dont know what the big deal is about this place but I wont be back yaall  ,bad
I immediately said I wanted to talk to the manager but I did not want to talk to the guy who was doing shots of fireball behind the bar ,bad
Your servers suck wait correction our server Heimer sucked ,bad
What happened next was prettyoff putting ,bad
Overpriced for what you are getting ,bad
I vomited in the bathroom mid lunch ,bad
I have been to very few places to eat that under no circumstances would I ever return to and this tops the list ,bad
All in all Ha Long Bay was a bit of a flop ,bad
Shrimp When I unwrapped it I live only 1/2 a mile from Brushfire it was literally ice cold ,bad
It really is impressive that the place hasnt closed down ,bad
I would avoid this place if you are staying in the Mirage ,bad
Spend your money and time some place else ,bad
the presentation of the food was awful ,bad
I cant tell you how disappointed I was ,bad
I think food should have flavor and texture and both were lacking ,bad
