Review,Rating
This place is overpriced not consistent with their boba and it really is OVERPRICED ,bad
It was packed ,bad
The seasonal fruit was fresh white peach puree ,good
It kept getting worse and worse so now Im officially done ,bad
This place should honestly be blown up ,bad
But I definitely would not eat here again ,bad
The crepe was delicate and thin and moist ,good
Awful service ,bad
The service here is fair at best ,bad
No one at the table thought the food was above average or worth the wait that we had for it ,bad
Best service and food ever Maria our server was so good and friendly she made our day ,good
They were excellent ,good
I paid the bill but did not tip because I felt the server did a terrible job ,bad
Just had lunch here and had a great experience ,good
The food came out at a good pace ,good
I ate there twice on my last visit and especially enjoyed the salmon salad ,good
We could not believe how dirty the oysters were ,bad
I would not recommend this place ,bad
To my disbelief each dish qualified as the worst version of these foods I have ever tasted ,bad
Bad day or not I have a very low tolerance for rude customer service people it is your job to be nice and polite wash dishes otherwise ,bad
the potatoes were great and so was the biscuit ,good
So flavorful and has just the perfect amount of heat ,good
Went in for happy hour great list of wines ,good
Some may say this buffet is pricey but I think you get what you pay for and this place you are getting quite a lot ,good
This place is pretty good nice little vibe in the restaurant ,good
Talk about great customer service of course we will be back ,good
I love their fries and their beans ,good
They have a plethora of salads and sandwiches and everything Ive tried gets my seal of approval ,good
For sushi on the Strip this is the place to go ,good
The feel of the dining room was more college cooking course than high class dining and the service was slow at best ,bad
I started this review with two stars but Im editing it to give it only one ,bad
Weird vibe from owners ,bad
There was hardly any meat ,bad
Ive had better bagels from the grocery store ,bad
I love the owner chef his one authentic Japanese cool dude ,good
Now the burgers arent as good the pizza which used to be amazing is doughy and flavorless ,bad
The service was terrible food was mediocre ,bad
I ordered Albondigas soup  which was just warm  and tasted like tomato soup with frozen meatballs ,bad
On three different occasions I asked for well done or medium well and all three times I got the bloodiest piece of meat on my plate ,bad
The service was extremely slow ,bad
After 20 minutes wait I got a table ,bad
No allergy warnings on the menu and the waitress had absolutely no clue as to which meals did or did not contain peanuts ,bad
My boyfriend tried the Mediterranean Chicken Salad and fell in love ,good
I want to first say our server was great and we had perfect service ,good
The pizza selections are good ,good
I had strawberry tea which was good ,good
Spend your money elsewhere ,bad
Their regular toasted bread was equally satisfying with the occasional pats of butter Mmmm ,good
The Buffet at Bellagio was far from what I anticipated ,bad
And the drinks are WEAK people ,bad
Very very sad ,bad
Im not impressed with the concept or the food ,bad
I got food poisoning here at the buffet ,bad
They brought a fresh batch of fries and I was thinking yay something warm but no ,bad
What SHOULD have been a hilarious yummy Christmas Eve dinner to remember was the biggest fail of the entire trip for us ,bad
Needless to say I wont be going back anytime soon ,bad
The RI style calamari was a joke ,bad
It was so bad I had lost the heart to finish it ,bad
We arent ones to make a scene at restaurants but I just dont get itdefinitely lost the love after this one ,bad
The food is about on par with Dennys which is to say not good at all ,bad
WAAAAAAyyyyyyyyyy over rated is all I am saying ,bad
This place lacked style ,bad
The sangria was about half of a glass wine full and was 12 ridiculous ,bad
Dont bother coming here ,bad
The building itself seems pretty neat; the bathroom is pretty trippy but I wouldnt eat here again ,bad
Probably not in a hurry to go back ,bad
Not good by any stretch of the imagination ,bad
The cashew cream sauce was bland and the vegetables were undercooked ,bad
It was a bit too sweet not really spicy enough and lacked flavor ,bad
This place is horrible and way overpriced ,bad
It wasnt busy at all and now we know why ,bad
The ambiance here did not feel like a buffet setting but more of a douchey indoor garden for tea and biscuits ,bad
Con spotty service ,bad
The fries were not hot and neither was my burger ,bad
The real disappointment was our waiter ,bad
My husband said she was very rude did not even apologize for the bad food or anything ,bad
She was quite disappointed although some blame needs to be placed at her door ,bad
Del Taco is pretty nasty and should be avoided if possible ,bad
Weve have gotten a much better service from the pizza place next door than the services we received from this restaurant ,bad
The ambiance isnt much better ,bad
Unfortunately it only set us up for disapppointment with our entrees ,bad
The food wasnt good ,bad
too bad cause I know its family owned I really wanted to like this place ,bad
I kept looking at the time and it had soon become 35 minutes yet still no food ,bad
We started with the tuna sashimi which was brownish in color and obviously wasnt fresh ,bad
Food was below average ,bad
It sure does beat the nachos at the movies but I would expect a little bit more coming from a restaurant ,bad
The problem I have is that they charge 1199 for a sandwich that is no bigger than a Subway sub which offers better and more amount of vegetables ,bad
It lacked flavor seemed undercooked and dry ,bad
The refried beans that came with my meal were dried out and crusty and the food was bland ,bad
A lady at the table next to us found a live green caterpillar In her salad ,bad
Would not go back ,bad
I was shocked because no signs indicate cash only ,bad
The food amazing ,good
Service is also cute ,good
I could care less The interior is just beautiful ,good
So they performed ,good
This hole in the wall has great Mexican street tacos and friendly staff ,good
The worst was the salmon sashimi ,bad
Also there are combos like a burger fries and beer for 23 which is a decent deal ,good
This was like the final blow ,bad
I found this place by accident and I could not be happier ,good
seems like a good quick place to grab a bite of some familiar pub food but do yourself a favor and look elsewhere ,bad
Ample portions and good prices ,good
Service sucks ,bad
Frozen pucks of disgust with some of the worst people behind the register ,bad
Its too bad the food is so damn generic ,bad
If you want a sandwich just go to any Firehouse ,good
My side Greek salad with the Greek dressing was so tasty and the pita and hummus was very refreshing ,good
Their chow mein is so good ,good
The portion was huge ,good
Loved itfriendly servers great food wonderful and imaginative menu ,good
The Heart Attack Grill in downtown Vegas is an absolutely flatlined excuse for a restaurant ,bad
The salad had just the right amount of sauce to not over power the scallop which was perfectly cooked ,good
The ripped banana was not only ripped but petrified and tasteless ,bad
Great food and service huge portions and they give a military discount ,good
Updatewent back for a second time and it was still just as amazing ,good
We got the food and apparently they have never heard of salt and the batter on the fish was chewy ,bad
The deal included 5 tastings and 2 drinks and Jeff went above and beyond what we expected ,good
The service was meh ,bad
It took over 30 min to get their milkshake which was nothing more than chocolate milk ,bad
I guess I should have known that this place would suck because it is inside of the Excalibur but I didnt use my common sense ,bad
2 times  Very Bad Customer Service  ,bad
The sweet potato fries were very good and seasoned well ,good
Today is the second time Ive been to their lunch buffet and it was pretty good ,good
walked in and the place smelled like an old grease trap and only 2 others there eating ,bad
The pan cakes everyone are raving about taste like a sugary disaster tailored to the palate of a six year old ,bad
The poor batter to meat ratio made the chicken tenders very unsatisfying ,bad
All I have to say is the food was amazing ,good
Everything was fresh and delicious ,good
Never been to Hard Rock Casino before WILL NEVER EVER STEP FORWARD IN IT AGAIN ,bad
say bye bye to your tip lady ,bad
Well never go again ,bad
Food arrived quickly ,good
It was not good ,bad
On the up side their cafe serves really good food ,good
I LOVED their mussels cooked in this wine reduction the duck was tender and their potato dishes were delicious ,good
This is one of the better buffets that I have been to ,good
Sooooo good ,good
Check it out ,good
It was pretty gross ,bad
Ive had better atmosphere ,bad
Kind of hard to mess up a steak but they did ,bad
Although I very much liked the look and sound of this place the actual experience was a bit disappointing ,bad
Worst service to boot but that is the least of their worries ,bad
Service was fine and the waitress was friendly ,good
The guys all had steaks and our steak loving son who has had steak at the best and worst places said it was the best steak hes ever eaten ,good
We thought youd have to venture further away to get good sushi but this place really hit the spot that night ,good
Phenomenal food service and ambiance ,good
I wouldnt return ,bad
Definitely worth venturing off the strip for the pork belly will return next time Im in Vegas ,good
Penne vodka excellent ,good
I had a seriously solid breakfast here ,good
This is one of the best bars with food in Vegas ,good
My drink was never empty and he made some really great menu suggestions ,good
Dont do it ,bad
My husband and I ate lunch here and were very disappointed with the food and service ,bad
This is a great restaurant at the Mandalay Bay ,good
We waited for forty five minutes in vain ,bad
Crostini that came with the salad was stale ,bad
I ordered the Voodoo pasta and it was the first time Id had really excellent pasta since going gluten free several years ago ,good
I came back today since they relocated and still not impressed ,bad
Their menu is diverse and reasonably priced ,good
So dont go there if you are looking for good food ,bad
Ive never been treated so bad ,bad
Bacon is hella salty ,good
This really is how Vegas fine dining used to be right down to the menus handed to the ladies that have no prices listed ,good
Everything on the menu is terrific and we were also thrilled that they made amazing accommodations for our vegetarian daughter ,good
Perhaps I caught them on an off night judging by the other reviews but Im not inspired to go back ,bad
The service here leaves a lot to be desired ,bad
Not a weekly haunt but definitely a place to come back to every once in a while ,good
We literally sat there for 20 minutes with no one asking to take our order ,bad
The burger had absolutely no flavor  the meat itself was totally bland the burger was overcooked and there was no charcoal flavor ,bad
It was probably dirt ,bad
Love this place hits the spot when I want something healthy but not lacking in quantity or flavor ,good
Also were served hot bread and butter and home made potato chips with bacon bits on topvery original and very good ,good
Both of the egg rolls were fantastic ,good
When my order arrived one of the gyros was missing ,bad
Im not really sure how Joeys was voted best hot dog in the Valley by readers of Phoenix Magazine ,bad
The best place to go for a tasty bowl of Pho ,good
Very friendly staff ,good
It is worth the drive ,good
I had heard good things about this place but it exceeding every hope I could have dreamed of ,good
Food was great and so was the serivce ,good
The warm beer didnt help ,bad
Ive lived here since 1979 and this was the first and last time Ive stepped foot into this place ,bad
Must have been an off night at this place ,bad
For about 10 minutes we were waiting for her salad when we realized that it wasnt coming any time soon ,bad
Wont go back ,bad
Extremely Tasty ,good
Waitress was good though ,good
The Jamaican mojitos are delicious ,good
The shower area is outside so you can only rinse not take a full shower unless you dont mind being nude for everyone to see ,bad
The service was a bit lacking ,bad
Lobster Bisque Bussell Sprouts Risotto Filet ALL needed salt and pepperand of course there is none at the tables ,bad
It was either too cold not enough flavor or just bad ,bad
The folks at Otto always make us feel so welcome and special ,good
This is the place where I first had pho and it was amazing ,good
This wonderful experience made this place a muststop whenever we are in town again ,good
If the food isnt bad enough for you then enjoy dealing with the worlds worst/annoying drunk people ,bad
Ordered a double cheeseburger & got a single patty that was falling apart picture uploaded Yeah still sucks ,bad
If it were possible to give them zero stars theyd have it ,bad
The descriptions said yum yum sauce and another said eel sauce  yet another said spicy mayo well NONE of the rolls had sauces on them ,bad
If she had not rolled the eyes we may have stayed Not sure if we will go back and try it again ,bad
Everyone is very attentive providing excellent customer service ,good
Horrible  dont waste your time and money ,bad
Now this dish was quite flavourful ,good
It wasnt busy either Also the building was FREEZING cold ,bad
like the other reviewer said you couldnt pay me to eat at this place again ,bad
Seriously flavorful delights folks ,good
Much better than the other AYCE sushi place I went to in Vegas ,good
There is nothing privileged about working/eating there ,bad
Overall I dont think that I would take my parents to this place again because they made most of the similar complaints that I silently felt too ,bad
Fantastic service here ,good
very tough and very short on flavor ,bad
I hope this place sticks around ,good
I have been in more than a few bars in Vegas and do not ever recall being charged for tap water ,bad
The seafood was fresh and generous in portion ,good
You cant beat that ,good
The goat taco didnt skimp on the meat and wow what FLAVOR ,good
I went to Bachi Burger on a friends recommendation and was not disappointed ,good
This place is not quality sushi it is not a quality restaurant ,bad
Great Pizza and Salads ,good
This place is amazing ,good
I hate to disagree with my fellow Yelpers but my husband and I were so disappointed with this place ,bad
I live in the neighborhood so I am disappointed I wont be back here because it is a convenient location ,bad
Before I go in to why I gave a 1 star rating please know that this was my third time eating at Bachi burger before writing a review ,bad
I love the fact that everything on their menu is worth it ,good
Never again will I be dining at this place ,bad
Please stay away from the shrimp stir fried noodles ,bad
This greedy corporation will NEVER see another dime from me ,bad
Will never ever go back ,bad
In the summer you can dine in a charming outdoor patio  so very delightful ,good
Fantastic food ,good
She ordered a toasted English muffin that came out untoasted ,bad
The food was very good ,good
Great food for the price which is very high quality and house made ,good
Back to good BBQ lighter fare reasonable pricing and tell the public they are back to the old ways ,good
And considering the two of us left there very full and happy for about 20 you just cant go wrong ,good
All the bread is made inhouse ,good
Service was exceptional and food was a good as all the reviews ,good
The black eyed peas and sweet potatoes UNREAL ,good
You wont be disappointed ,good
I go to far too many places and Ive never seen any restaurant that serves a 1 egg breakfast especially for 400 ,bad
Both of them were truly unbelievably good and I am so glad we went back ,good
We had fantastic service and were pleased by the atmosphere ,good
I love this place ,good
Great service and food ,good
First  the bathrooms at this location were dirty Seat covers were not replenished & just plain yucky ,bad
The burger I got the Gold Standard a 17 burger and was kind of disappointed ,bad
OMG the food was delicioso ,good
There is nothing authentic about this place ,bad
Of all the dishes the salmon was the best but all were great ,good
Pretty good beer selection too ,good
Classy/warm atmosphere fun and fresh appetizers succulent steaks Baseball steak ,good
We sat another ten minutes and finally gave up and left ,bad
He was terrible ,bad
Everyone is treated equally special ,good
It shouldnt take 30 min for pancakes and eggs ,bad
It was delicious ,good
Sadly Gordon Ramseys Steak is a place we shall sharply avoid during our next trip to Vegas ,bad
Best fish Ive ever had in my life ,good
The bathroom is just next door and very nice ,good
This is an Outstanding little restaurant with some of the Best Food I have ever tasted ,good
Definitely a turn off for me & i doubt Ill be back unless someone else is buying ,bad
Server did a great job handling our large rowdy table ,good
I find wasting food to be despicable but this just wasnt food ,bad
Would come back again if I had a sushi craving while in Vegas ,good
He deserves 5 stars ,good
I left with a stomach ache and felt sick the rest of the day ,bad
They dropped more than the ball ,bad
RUDE & INCONSIDERATE MANAGEMENT ,bad
They have great dinners ,good
This place deserves one star and 90% has to do with the food ,bad
Def coming back to bowl next time ,good
I will continue to come here on ladies night andddd date night  highly recommend this place to anyone who is in the area ; ,good
We walked away stuffed and happy about our first Vegas buffet experience ,good
To summarize the food was incredible nay transcendant but nothing brings me joy quite like the memory of the pneumatic condiment dispenser ,good
Im probably one of the few people to ever go to Ians and not like it ,bad
Cooked to perfection and the service was impeccable ,good
This one is simply a disappointment ,bad
Overall I was very disappointed with the quality of food at Bouchon ,bad
I dont have to be an accountant to know Im getting screwed ,bad
Service was fantastic ,good
I dont know what kind it is but they have the best iced tea ,good
Come hungry leave happy and stuffed ,good
I can assure you that you wont be disappointed ,good
I can take a little bad service but the food sucks ,bad
I really enjoyed eating here ,good
Our server was very nice and even though he looked a little overwhelmed with all of our needs he stayed professional and friendly until the end ,good
Furthermore you cant even find hours of operation on the website ,bad
Weve tried to like this place but after 10+ times I think were done with them ,bad
What a mistake that was ,bad
No complaints ,good
Strike 2 who wants to be rushed ,bad
I never come again ,bad
We loved the biscuits ,good
Ordered an appetizer and took 40 minutes and then the pizza another 10 minutes ,bad
So absolutley fantastic ,good
definitely will come back here again ,good
I like Steiners because its dark and it feels like a bar ,good
If youre not familiar check it out ,good
Nothing special ,bad
Will not be back ,bad
My ribeye steak was cooked perfectly and had great mesquite flavor ,good
I dont think well be going back anytime soon ,bad
I am far from a sushi connoisseur but I can definitely tell the difference between good food and bad food and this was certainly bad food ,bad
I was so insulted ,bad
Nargile  I think you are great ,good
We loved the place ,good
Definitely not worth the 3 I paid ,bad
The vanilla ice cream was creamy and smooth while the profiterole choux pastry was fresh enough ,good
The inside is really quite nice and very clean ,good
The food was outstanding and the prices were very reasonable ,good
This is was due to the fact that it took 20 minutes to be acknowledged then another 35 minutes to get our foodand they kept forgetting things ,bad
Love the margaritas too ,good
This was my first and only Vegas buffet and it did not disappoint ,good
Very good though ,good
The one down note is the ventilation could use some upgrading ,bad
Great pork sandwich ,good
Third the cheese on my friends burger was cold ,bad
We enjoy their pizza and brunch ,good
This place is a jewel in Las Vegas and exactly what Ive been hoping to find in nearly ten years living here ,good
The selection of food was not the best ,bad
They had a toro tartare with a cavier that was extraordinary and I liked the thinly sliced wagyu with white truffle ,good
It was attached to a gas station and that is rarely a good sign ,bad
How awesome is that ,good
The menu had so much good stuff on it i could not decide ,good
Worse of all he humiliated his worker right in front of meBunch of horrible name callings ,bad
CONCLUSION Very filling meals ,good
Their daily specials are always a hit with my group ,good
The pancake was also really good and pretty large at that ,good
This was my first crawfish experience and it was delicious ,good
Their monster chicken fried steak and eggs is my all time favorite ,good
Id rather eat airline food seriously ,bad
The ambiance was incredible ,good
My gyro was basically lettuce only ,bad
Terrible service ,bad
Thoroughly disappointed ,bad
I dont each much pasta but I love the homemade /hand made pastas and thin pizzas here ,good
Give it a try you will be happy you did ,good
By far the BEST cheesecurds we have ever had ,good
Reasonably priced also ,good
it was a drive to get there ,bad
Point your finger at any item on the menu order it and you wont be disappointed ,good
first time there and might just be the last ,bad
Similarly the delivery man did not say a word of apology when our food was 45 minutes late ,bad
And it was way to expensive ,bad
The bartender was also nice ,good
Everything was good and tasty ,good
The best place in Vegas for breakfast just check out a Sat or Sun ,good
If you love authentic Mexican food and want a whole bunch of interesting yet delicious meats to choose from you need to try this place ,good
An excellent new restaurant by an experienced Frenchman ,good
If there were zero stars I would give it zero stars ,bad
Worst martini ever ,bad
I had the opportunity today to sample your amazing pizzas ,good
The yellowtail carpaccio was melt in your mouth fresh ,good
No Im going to eat the potato that I found some strangers hair in it ,bad
not even a hello we will be right with you ,bad
I really do recommend this place you can go wrong with this donut place ,good
I guess maybe we went on an off night but it was disgraceful ,bad
However my recent experience at this particular location was not so good ,bad
I know this is not like the other restaurants at all something is very off here ,bad
AVOID THIS ESTABLISHMENT ,bad
I think this restaurant suffers from not trying hard enough ,bad
All of the tapas dishes were delicious ,good
I heart this place ,good
My salad had a bland vinegrette on the baby greens and hearts of Palm ,bad
After two I felt disgusting ,bad
I believe that this place is a great stop for those with a huge belly and hankering for sushi ,good
I will never go back to this place and will never ever recommended this place to anyone ,bad
The servers went back and forth several times not even so much as an Are you being helped? ,bad
AN HOUR seriously,bad
Eew This location needs a complete overhaul ,bad
He also came back to check on us regularly excellent service ,good
Our server was super nice and checked on us many times ,good
The pizza tasted old super chewy in not a good way ,bad
As for the service Im a fan because its quick and youre being served by some nice folks ,good
Boy was that sucker dry ,bad
Over rated ,bad
After I pulled up my car I waited for another 15 minutes before being acknowledged ,bad
Great food and great service in a clean and friendly setting ,good
All in all I can assure you Ill be back ,good
My breakfast was perpared great with a beautiful presentation of 3 giant slices of Toast lightly dusted with powdered sugar ,good
OMG I felt like I had never eaten Thai food until this dish ,good
It was extremely crumby and pretty tasteless ,bad
Itll be a regular stop on my trips to Phoenix ,good
We got sitting fairly fast but ended up waiting 40 minutes just to place our order another 30 minutes before the food arrived ,bad
Couldnt ask for a more satisfying meal ,good
I just wanted to leave ,bad
I will not be eating there again ,bad
Sorry I will not be getting food from here anytime soon  ,bad
The cow tongue and cheek tacos are amazing ,good
My friend did not like his Bloody Mary ,bad
They really want to make your experience a good one ,good
Very disappointing ,bad
a drive thru means you do not want to wait around for half an hour for your food but somehow when we end up going here they make us wait and wait ,bad
Ambience is perfect ,good
Best of luck to the rude and noncustomer service focused new management ,bad
Any grandmother can make a roasted chicken better than this one ,bad
I asked multiple times for the wine list and after some time of being ignored I went to the hostess and got one myself ,bad
Same evening him and I are both drastically sick ,bad
Highquality chicken on the chicken Caesar salad ,good
We were promptly greeted and seated ,good
